{
  "$schema": "https://json-schema.org/draft/2020-12/schema",
  "$id": "https://blueops.invalid/schemas/run-manifest/0.1.0",
  "title": "BlueOps run manifest",
  "description": "Integrity record written beside report.json in every collector run directory: SHA-256 and size of each output file and of the collector scripts that produced them. It cannot vouch for itself; record its digest off the host. Verify with `python -m shared.reporting.verify RUN_DIR`.",
  "type": "object",
  "additionalProperties": false,
  "required": ["schema_version", "kind", "hash_algorithm", "complete", "tool", "run", "host", "files", "collector"],
  "properties": {
    "schema_version": { "type": "string", "pattern": "^0\\.\\d+\\.\\d+$" },
    "kind": { "const": "run-manifest" },
    "hash_algorithm": { "const": "sha256" },
    "complete": {
      "type": "boolean",
      "description": "False when a digest could not be computed (no SHA-256 tool on the host); such a manifest cannot verify the run."
    },
    "tool": {
      "type": "object",
      "additionalProperties": false,
      "required": ["name", "version"],
      "properties": { "name": { "type": "string" }, "version": { "type": "string" } }
    },
    "run": {
      "type": "object",
      "additionalProperties": false,
      "required": ["id", "started_at", "finished_at", "exit_code"],
      "properties": {
        "id": { "type": "string", "minLength": 1 },
        "started_at": { "type": "string", "pattern": "^\\d{4}-\\d{2}-\\d{2}T\\d{2}:\\d{2}:\\d{2}Z$" },
        "finished_at": { "type": "string", "pattern": "^\\d{4}-\\d{2}-\\d{2}T\\d{2}:\\d{2}:\\d{2}Z$" },
        "exit_code": { "type": "integer", "minimum": 0, "maximum": 6 }
      }
    },
    "host": {
      "type": "object",
      "required": ["hostname"],
      "properties": {
        "hostname": { "type": "string", "minLength": 1 },
        "user": { "type": "string" },
        "elevated": { "type": "boolean" },
        "test_mode": { "const": true }
      }
    },
    "files": {
      "type": "array",
      "minItems": 1,
      "items": {
        "type": "object",
        "additionalProperties": false,
        "required": ["path", "sha256", "size"],
        "properties": {
          "path": { "type": "string", "pattern": "^[A-Za-z0-9._-]{1,128}$" },
          "sha256": { "oneOf": [{ "type": "string", "pattern": "^[0-9a-f]{64}$" }, { "type": "null" }] },
          "size": { "type": "integer", "minimum": 0 }
        }
      }
    },
    "collector": {
      "type": "array",
      "items": {
        "type": "object",
        "additionalProperties": false,
        "required": ["path", "sha256"],
        "properties": {
          "path": { "type": "string", "minLength": 1 },
          "sha256": { "oneOf": [{ "type": "string", "pattern": "^[0-9a-f]{64}$" }, { "type": "null" }] }
        }
      }
    }
  }
}
